[
  {
    "nme": "UNIVERSITY LEGAL SERVICES",
    "phone1": "202-527-7070",
    "statecd": "DC",
    "weburl": "https://www.uls-dc.org/",
    "zipcd": "20019-3402",
    "agc_ADDR_LATITUDE": "38.894443",
    "agc_ADDR_LONGITUDE": "-76.948045",
    "languages": "ENG",
    "parentid": "80219",
    "agcid": "90489",
    "adr1": "3939 Benning Rd NE",
    "adr2": null,
    "city": "WASHINGTON",
    "county_NME": "",
    "phone2": null,
    "mailingadr1": "3939 Benning Rd NE",
    "mailingadr2": null,
    "mailingcity": "Washington",
    "mailingzipcd": "20019",
    "mailingstatecd": "DC",
    "state_NME": "District of Columbia",
    "state_FIPS_CODE": null,
    "faithbased": "N",
    "colonias_IND": "N",
    "migrantwkrs_IND": "N",
    "agc_STATUS": "P",
    "agc_SRC_CD": "HUD",
    "counslg_METHOD": "Face to Face Counseling,Group Counseling,Phone Counseling,Video Conference",
    "email": "swallace@uls-dc.org",
    "fax": "202-527-7077",
    "services": "DFC,FBC,FBW,FHW,HIC,HMC,NDW,PLW,PPC,PPW,RHC,RHW"
  },
  {
    "nme": "HOUSING COUNSELING SERVICES, INCORPORATED (HSC,INC.)",
    "phone1": "202-667-7006",
    "statecd": "DC",
    "weburl": "http://www.housingetc.org",
    "zipcd": "20009-2724",
    "agc_ADDR_LATITUDE": "38.921683",
    "agc_ADDR_LONGITUDE": "-77.039117",
    "languages": "CHI,ENG,FAR,FRE,OTH,POR,SPA",
    "parentid": null,
    "agcid": "80216",
    "adr1": "2410 17th St NW Ste 100",
    "adr2": null,
    "city": "Washington",
    "county_NME": "",
    "phone2": "202-667-7006",
    "mailingadr1": "2410 17th St NW Ste 100",
    "mailingadr2": null,
    "mailingcity": "Washington",
    "mailingzipcd": "20009-2724",
    "mailingstatecd": "DC",
    "state_NME": "District of Columbia",
    "state_FIPS_CODE": null,
    "faithbased": "N",
    "colonias_IND": "N",
    "migrantwkrs_IND": "N",
    "agc_STATUS": "A",
    "agc_SRC_CD": "HUD",
    "counslg_METHOD": "Face to Face Counseling,Group Counseling,Internet Counseling,Phone Counseling,Video Conference",
    "email": "theresahill@housingetc.org",
    "fax": null,
    "services": "DFC,DFW,FBC,FBW,HIC,HMC,NDW,PPC,PPW,RHC,RHW,RMC"
  }
]
